name,region,lead_time_weeks,capacity_kg_per_week,cost_per_kg,quality_rating,is_qualified,notes
VSMPO-AVISMA,Russia,16,327000,18.50,0.90,false,"World's largest Ti producer; pre-war capacity ~34000 MT/yr sponge; output dropped to ~17000 MT/yr post-2022; Boeing suspended purchases Mar 2022; Airbus phasing out; parent Rostec sanctioned; high geopolitical risk"
TIMET (PCC/Berkshire Hathaway),United States,12,250000,35.00,0.97,true,"~13000 MT/yr sponge capacity at Henderson NV (idled since 2020); major mill products producer; owned by Precision Castparts/Berkshire Hathaway since 2012; supplies ~20% of world Ti; Ravenswood WV expansion underway"
Toho Titanium,Japan,14,485000,30.00,0.96,true,"25200 MT/yr sponge capacity (Wakamatsu 15600 + Chigasaki 9600); expanding +3000 MT by 2026; Japan is #1 US sponge import source (67% of imports); aerospace-qualified; highly reliable"
ATI Inc,United States,10,192000,38.00,0.97,true,"Major US Ti mill products producer; 80% capacity increase over FY2022 baseline by late 2025; Albany OR and Richland WA facilities; multi-year Airbus supply contract signed May 2025; no sponge production (melts purchased sponge)"
Baoji Titanium Industry (BAOTI),China,18,385000,22.00,0.82,false,"30000 MT/yr ingot capacity; 20000 MT/yr mill products; qualified by Boeing Airbus Rolls-Royce for non-critical parts; Chinese Ti generally not approved for critical aerospace structures in Western programs; low cost producer"
Kobe Steel (KOBELCO),Japan,14,115000,33.00,0.88,true,"~6000 MT/yr Ti products capacity; supplies Airbus A350 landing gear forgings; GE jet engine shafts via IHI; first Japanese supplier qualified by Rolls-Royce (2001); 2017 data falsification scandal affected trust; since remediated"
Western Superconducting (WST),China,20,288000,20.00,0.80,false,"Major Chinese Ti alloy bar producer for aerospace; ~15000 MT/yr capacity; new 63/80-MN forging press from SMS group; primarily serves Chinese domestic aerospace (COMAC C919 J-36); limited Western aerospace qualification"
Howmet Aerospace (RTI/Arconic),United States,12,173000,36.00,0.96,true,"Formerly RTI International Metals; key Boeing 787 and Airbus A350 Ti supplier; produces sheets plates bars forgings; vertically integrated; strong aerospace qualification across major OEMs"
